{
  "profile_id": "profile_stage5e_demo",
  "source_chart_id": "default_chart_001",
  "source_libraries": [
    "static-stage5b-demo"
  ],
  "calculation_mode": "recorded_time",
  "pillars": {
    "year": {
      "stem": "甲",
      "branch": "子"
    },
    "month": {
      "stem": "丙",
      "branch": "寅"
    },
    "day": {
      "stem": "戊",
      "branch": "辰"
    },
    "hour": {
      "stem": "壬",
      "branch": "戌"
    }
  },
  "day_master": "戊",
  "five_elements": {
    "wood": 2,
    "fire": 1,
    "earth": 3,
    "metal": 0,
    "water": 2
  },
  "ten_gods": [
    {
      "pillar": "year",
      "god": "偏财"
    },
    {
      "pillar": "month",
      "god": "偏印"
    }
  ],
  "hidden_stems": [
    {
      "branch": "辰",
      "stems": [
        "戊",
        "乙",
        "癸"
      ]
    }
  ],
  "nayin": [
    {
      "pillar": "year",
      "value": "海中金"
    }
  ],
  "stars": [],
  "shensha": [],
  "relations": {
    "clashes": [],
    "combinations": [],
    "punishments": [],
    "harms": []
  },
  "luck_cycles": [
    {
      "start_age": 8,
      "label": "demo_luck_cycle"
    }
  ],
  "annual_fortunes": [
    {
      "year": 2026,
      "label": "demo_annual_fortune"
    }
  ],
  "assumptions": [
    "demo profile for Stage 5E fixture"
  ],
  "warnings": [],
  "raw": null
}